{
  "schema_version": "theme-code-links-v1",
  "kind": "theme-code-links",
  "slug": "graph-neural-network",
  "generated_at": "2026-10-26T00:31:31Z",
  "sources": [
    "huggingface-papers"
  ],
  "nodes": {
    "openalex:W2519887557": {
      "arxiv_id": "1609.02907",
      "code": null,
      "hf": {
        "url": "https://huggingface.co/papers/1609.02907",
        "upvotes": 0,
        "models": 0,
        "datasets": 1,
        "spaces": 1
      }
    },
    "openalex:W2554952599": {
      "arxiv_id": "1611.07308",
      "code": null,
      "hf": {
        "url": "https://huggingface.co/papers/1611.07308",
        "upvotes": 0,
        "models": 1,
        "datasets": 0,
        "spaces": 1
      }
    },
    "openalex:W2604314403": {
      "arxiv_id": "1703.06103",
      "code": null,
      "hf": {
        "url": "https://huggingface.co/papers/1703.06103",
        "upvotes": 1,
        "models": 2,
        "datasets": 0,
        "spaces": 1
      }
    },
    "openalex:W2624431344": {
      "arxiv_id": "1706.02216",
      "code": null,
      "hf": {
        "url": "https://huggingface.co/papers/1706.02216",
        "upvotes": 2,
        "models": 3,
        "datasets": 1,
        "spaces": 2
      }
    },
    "openalex:W2766453196": {
      "arxiv_id": "1710.10903",
      "code": null,
      "hf": {
        "url": "https://huggingface.co/papers/1710.10903",
        "upvotes": 1,
        "models": 2,
        "datasets": 1,
        "spaces": 0
      }
    },
    "openalex:W2918342466": {
      "arxiv_id": "1903.02428",
      "code": null,
      "hf": {
        "url": "https://huggingface.co/papers/1903.02428",
        "upvotes": 0,
        "models": 1,
        "datasets": 0,
        "spaces": 0
      }
    },
    "openalex:W2972317931": {
      "arxiv_id": "1903.03894",
      "code": null,
      "hf": {
        "url": "https://huggingface.co/papers/1903.03894",
        "upvotes": 1,
        "models": 0,
        "datasets": 0,
        "spaces": 0
      }
    }
  }
}
