{
  "schema_version": "theme-code-links-v1",
  "kind": "theme-code-links",
  "slug": "reinforcement-learning-from-human-feedback",
  "generated_at": "2026-10-25T09:04:11Z",
  "sources": [
    "huggingface-papers",
    "paper_repos"
  ],
  "nodes": {
    "openalex:W2626804490": {
      "arxiv_id": "1706.03741",
      "code": null,
      "hf": {
        "url": "https://huggingface.co/papers/1706.03741",
        "upvotes": 4,
        "models": 1,
        "datasets": 0,
        "spaces": 0
      }
    },
    "openalex:W3213126186": {
      "arxiv_id": "2111.04850",
      "code": null,
      "hf": {
        "url": "https://huggingface.co/papers/2111.04850",
        "upvotes": 2,
        "models": 0,
        "datasets": 0,
        "spaces": 0
      }
    },
    "openalex:W4223908421": {
      "arxiv_id": "2204.05862",
      "code": null,
      "hf": {
        "url": "https://huggingface.co/papers/2204.05862",
        "upvotes": 4,
        "models": 28,
        "datasets": 41,
        "spaces": 110
      }
    },
    "openalex:W4296413526": {
      "arxiv_id": "2209.07858",
      "code": null,
      "hf": {
        "url": "https://huggingface.co/papers/2209.07858",
        "upvotes": 0,
        "models": 0,
        "datasets": 5,
        "spaces": 2
      }
    },
    "openalex:W4307001524": {
      "arxiv_id": "2210.10760",
      "code": null,
      "hf": {
        "url": "https://huggingface.co/papers/2210.10760",
        "upvotes": 1,
        "models": 0,
        "datasets": 0,
        "spaces": 1
      }
    },
    "openalex:W4318350868": {
      "arxiv_id": "2301.11270",
      "code": null,
      "hf": {
        "url": "https://huggingface.co/papers/2301.11270",
        "upvotes": 2,
        "models": 3,
        "datasets": 0,
        "spaces": 0
      }
    },
    "openalex:W4320559944": {
      "arxiv_id": "2302.05206",
      "code": null,
      "hf": {
        "url": "https://huggingface.co/papers/2302.05206",
        "upvotes": 0,
        "models": 2,
        "datasets": 0,
        "spaces": 0
      }
    },
    "openalex:W4321392329": {
      "arxiv_id": "2302.08582",
      "code": null,
      "hf": {
        "url": "https://huggingface.co/papers/2302.08582",
        "upvotes": 0,
        "models": 22,
        "datasets": 0,
        "spaces": 0
      }
    },
    "openalex:W4361807044": {
      "arxiv_id": "2303.16755",
      "code": null,
      "hf": {
        "url": "https://huggingface.co/papers/2303.16755",
        "upvotes": 1,
        "models": 2,
        "datasets": 0,
        "spaces": 0
      }
    },
    "openalex:W4365211596": {
      "arxiv_id": "2304.05302",
      "code": null,
      "hf": {
        "url": "https://huggingface.co/papers/2304.05302",
        "upvotes": 0,
        "models": 2,
        "datasets": 0,
        "spaces": 0
      }
    },
    "openalex:W4366196653": {
      "arxiv_id": "2304.06767",
      "code": null,
      "hf": {
        "url": "https://huggingface.co/papers/2304.06767",
        "upvotes": 2,
        "models": 8,
        "datasets": 0,
        "spaces": 0
      }
    },
    "openalex:W4366341216": {
      "arxiv_id": "2304.07327",
      "code": null,
      "hf": {
        "url": "https://huggingface.co/papers/2304.07327",
        "upvotes": 10,
        "models": 81,
        "datasets": 39,
        "spaces": 120
      }
    },
    "openalex:W4377121527": {
      "arxiv_id": "2305.10425",
      "code": null,
      "hf": {
        "url": "https://huggingface.co/papers/2305.10425",
        "upvotes": 7,
        "models": 8,
        "datasets": 0,
        "spaces": 1
      }
    },
    "openalex:W4378770449": {
      "arxiv_id": "2305.17306",
      "code": null,
      "hf": {
        "url": "https://huggingface.co/papers/2305.17306",
        "upvotes": 2,
        "models": 0,
        "datasets": 0,
        "spaces": 0
      }
    },
    "openalex:W4379474731": {
      "arxiv_id": "2306.01693",
      "code": null,
      "hf": {
        "url": "https://huggingface.co/papers/2306.01693",
        "upvotes": 3,
        "models": 0,
        "datasets": 0,
        "spaces": 0
      }
    },
    "openalex:W4384111857": {
      "arxiv_id": "2307.04964",
      "code": null,
      "hf": {
        "url": "https://huggingface.co/papers/2307.04964",
        "upvotes": 30,
        "models": 4,
        "datasets": 0,
        "spaces": 0
      }
    },
    "openalex:W4385436553": {
      "arxiv_id": "2307.15217",
      "code": null,
      "hf": {
        "url": "https://huggingface.co/papers/2307.15217",
        "upvotes": 39,
        "models": 0,
        "datasets": 0,
        "spaces": 0
      }
    },
    "openalex:W4385573519": {
      "arxiv_id": "2205.11275",
      "code": null,
      "hf": {
        "url": "https://huggingface.co/papers/2205.11275",
        "upvotes": 1,
        "models": 0,
        "datasets": 0,
        "spaces": 0
      }
    },
    "openalex:W4386348147": {
      "arxiv_id": "2308.15812",
      "code": null,
      "hf": {
        "url": "https://huggingface.co/papers/2308.15812",
        "upvotes": 1,
        "models": 2,
        "datasets": 1,
        "spaces": 0
      }
    },
    "openalex:W4386437475": {
      "arxiv_id": "2309.00267",
      "code": null,
      "hf": {
        "url": "https://huggingface.co/papers/2309.00267",
        "upvotes": 53,
        "models": 0,
        "datasets": 0,
        "spaces": 1
      }
    },
    "openalex:W4387322976": {
      "arxiv_id": "2310.01377",
      "code": null,
      "hf": {
        "url": "https://huggingface.co/papers/2310.01377",
        "upvotes": 6,
        "models": 101,
        "datasets": 82,
        "spaces": 21197
      }
    },
    "openalex:W4387561082": {
      "arxiv_id": "2310.06452",
      "code": null,
      "hf": {
        "url": "https://huggingface.co/papers/2310.06452",
        "upvotes": 2,
        "models": 0,
        "datasets": 6,
        "spaces": 0
      }
    },
    "openalex:W4387801352": {
      "arxiv_id": "2310.12036",
      "code": null,
      "hf": {
        "url": "https://huggingface.co/papers/2310.12036",
        "upvotes": 20,
        "models": 2,
        "datasets": 0,
        "spaces": 0
      }
    },
    "openalex:W4387838992": {
      "arxiv_id": "2310.12773",
      "code": null,
      "hf": {
        "url": "https://huggingface.co/papers/2310.12773",
        "upvotes": 28,
        "models": 12,
        "datasets": 0,
        "spaces": 3
      }
    },
    "openalex:W4389520260": {
      "arxiv_id": "2310.05344",
      "code": null,
      "hf": {
        "url": "https://huggingface.co/papers/2310.05344",
        "upvotes": 1,
        "models": 29,
        "datasets": 3,
        "spaces": 178
      }
    },
    "openalex:W4390380480": {
      "arxiv_id": "2312.15997",
      "code": null,
      "hf": {
        "url": "https://huggingface.co/papers/2312.15997",
        "upvotes": 2,
        "models": 1,
        "datasets": 0,
        "spaces": 0
      }
    },
    "openalex:W4390723302": {
      "arxiv_id": "2401.04056",
      "code": null,
      "hf": {
        "url": "https://huggingface.co/papers/2401.04056",
        "upvotes": 2,
        "models": 0,
        "datasets": 0,
        "spaces": 0
      }
    },
    "openalex:W4393160410": {
      "arxiv_id": "2306.17492",
      "code": null,
      "hf": {
        "url": "https://huggingface.co/papers/2306.17492",
        "upvotes": 6,
        "models": 5,
        "datasets": 0,
        "spaces": 0
      }
    },
    "openalex:W4398859186": {
      "arxiv_id": "2405.14734",
      "code": null,
      "hf": {
        "url": "https://huggingface.co/papers/2405.14734",
        "upvotes": 13,
        "models": 155,
        "datasets": 4,
        "spaces": 23
      }
    },
    "openalex:W4402753770": {
      "arxiv_id": "2311.13231",
      "code": null,
      "hf": {
        "url": "https://huggingface.co/papers/2311.13231",
        "upvotes": 28,
        "models": 0,
        "datasets": 1,
        "spaces": 0
      }
    },
    "openalex:W4417090724": {
      "arxiv_id": "2504.12501",
      "code": {
        "url": "https://github.com/natolambert/rlhf-book",
        "stars": 2466,
        "source": "huggingface-papers"
      },
      "hf": {
        "url": "https://huggingface.co/papers/2504.12501",
        "upvotes": 4,
        "models": 1,
        "datasets": 0,
        "spaces": 0
      }
    },
    "openalex:W7133189643": {
      "arxiv_id": "2305.11206",
      "code": null,
      "hf": {
        "url": "https://huggingface.co/papers/2305.11206",
        "upvotes": 27,
        "models": 24,
        "datasets": 34,
        "spaces": 6
      }
    },
    "openalex:W7133208539": {
      "arxiv_id": "2305.18290",
      "code": {
        "url": "https://github.com/eric-mitchell/direct-preference-optimization",
        "stars": 2920,
        "source": "paper_repos"
      },
      "hf": {
        "url": "https://huggingface.co/papers/2305.18290",
        "upvotes": 72,
        "models": 1000,
        "datasets": 28,
        "spaces": 21758
      }
    },
    "openalex:W7133211372": {
      "arxiv_id": "2203.02155",
      "code": {
        "url": "https://github.com/openai/following-instructions-human-feedback",
        "stars": 1258,
        "source": "paper_repos"
      },
      "hf": {
        "url": "https://huggingface.co/papers/2203.02155",
        "upvotes": 26,
        "models": 47,
        "datasets": 47,
        "spaces": 86
      }
    },
    "openalex:W7133218729": {
      "arxiv_id": "2305.03047",
      "code": null,
      "hf": {
        "url": "https://huggingface.co/papers/2305.03047",
        "upvotes": 1,
        "models": 0,
        "datasets": 1,
        "spaces": 2
      }
    },
    "openalex:W7133220558": {
      "arxiv_id": "2305.14387",
      "code": null,
      "hf": {
        "url": "https://huggingface.co/papers/2305.14387",
        "upvotes": 1,
        "models": 1,
        "datasets": 1,
        "spaces": 1
      }
    }
  }
}
